post_id,category,hook,body,hashtags,cta,image_file,status
insta_post_001,portfolio,This church had no website. Now they look like this.,Mobile-ready. Fast. Clean. DM for a free audit.,#webdesign #churchwebsite #smallbusiness #nonprofit,DM for a free website audit,insta_post_001_portfolio.png,generated
insta_post_002,portfolio,Before: a broken link. After: this.,Built for churches nonprofits small businesses. DM me.,#webdesigner #aitips #automation #chatgpt #productivity,DM for a free website audit,insta_post_002_portfolio.png,generated
insta_post_003,portfolio,I rebuilt this church's site in 48 hours.,Your visitors judge you in 3 seconds. Make them count.,#faithdriven #christianbusiness #haitianamerican #buildinpublic,DM for a free website audit,insta_post_003_portfolio.png,generated
insta_post_004,portfolio,Your website is your first impression.,I build before you pay. Volume creates results. DM me.,#behindthescenes #hustle #nightshift #volume #results,DM for a free website audit,insta_post_004_portfolio.png,generated
insta_post_005,portfolio,Most churches are invisible online.,Service times. Contact forms. Team bios. All working. DM audit.,#freeaudit #webdev #frontend #responsive #mobilefirst,DM for a free website audit,insta_post_005_portfolio.png,generated
